<?xml version="1.0" encoding="UTF-8"?>

<!-- 
    file                 : car4-trb1.xml
    created              : Thu Oct 11 13:15:57 CET 2007
    copyright            : (C) 2007 by Eric EspiÃ©, Bernhard Wymann
    email                : berniw@bluewin.ch
    version              : $Id: default.xml,v 1.5.2.1 2008/05/30 23:18:14 berniw Exp $
-->

<!--    This program is free software; you can redistribute it and/or modify  -->
<!--    it under the terms of the GNU General Public License as published by  -->
<!--    the Free Software Foundation; either version 2 of the License, or     -->
<!--    (at your option) any later version.                                   -->
<!DOCTYPE params SYSTEM "../../../../src/libs/tgf/params.dtd">

<params name="car4-trb1" type="template">

  <section name="Car">
    <attnum name="initial fuel" unit="l" min="1.0" max="95.0" val="95.0"/>
  </section>

  <section name="Front Wing">
	  <attnum name="angle" unit="deg" min="0" max="12" val="4"/>
  </section>

  <section name="Rear Wing">
    <attnum name="angle" unit="deg" min="0" max="18" val="10"/>
  </section>

  <section name="Gearbox">
    <section name="gears">
      <section name="r">
        <attnum name="ratio" min="-3" max="0" val="-2.0"/>
      </section>

      <section name="1">
        <attnum name="ratio" min="0" max="5" val="3.8"/>
      </section>

      <section name="2">
        <attnum name="ratio" min="0" max="5" val="2.8"/>
      </section>

      <section name="3">
        <attnum name="ratio" min="0" max="5" val="1.85"/>
      </section>

      <section name="4">
        <attnum name="ratio" min="0" max="5" val="1.45"/>
      </section>

      <section name="5">
        <attnum name="ratio" min="0" max="5" val="1.25"/>
      </section>

      <section name="6">
        <attnum name="ratio" min="0" max="5" val="1.08"/>
      </section>
    </section>
  </section>

  <section name="Brake System">
    <attnum name="front-rear brake repartition" min="0.3" max="0.7" val="0.52"/>
    <attnum name="max pressure" unit="kPa" min="100" max="150000" val="30000"/>
  </section>

  <section name="Rear Differential">
    <attstr name="type" in="SPOOL,FREE, LIMITED SLIP" val="LIMITED SLIP"/>
    <attnum name="ratio" min="0" max="10" val="3.07"/>
  </section>

  <section name="Front Right Wheel">
    <attnum name="ride height" unit="mm" min="100" max="300" val="100"/>
    <attnum name="toe" unit="deg" min="-5" max="5" val="0"/>
    <attnum name="camber" min="-5" max="-3" unit="deg" val="-5"/>
  </section>

  <section name="Front Left Wheel">
    <attnum name="ride height" unit="mm" min="100" max="300" val="100"/>
    <attnum name="toe" unit="deg" min="-5" max="5" val="0"/>
    <attnum name="camber" min="-5" max="-3" unit="deg" val="-5"/>
  </section>

  <section name="Rear Right Wheel">
    <attnum name="ride height" unit="mm" min="100" max="300" val="100"/>
    <attnum name="toe" unit="deg" min="0" max="0" val="0"/>
    <attnum name="camber" min="-5" max="-2" unit="deg" val="-3"/>
  </section>

  <section name="Rear Left Wheel">
    <attnum name="ride height" unit="mm" min="100" max="300" val="100"/>
    <attnum name="toe" unit="deg" min="0" max="0" val="0"/>
    <attnum name="camber" min="-5" max="-2" unit="deg" val="-3"/>
  </section>

  <section name="Front Anti-Roll Bar">
    <attnum name="spring" unit="lbs/in" min="0" max="5000" val="0"/>
  </section>

  <section name="Rear Anti-Roll Bar">
    <attnum name="spring" unit="lbs/in" min="0" max="5000" val="0"/>
  </section>

  <section name="Front Right Suspension">
    <attnum name="spring" unit="lbs/in" min="0" max="10000" val="5500"/>
    <attnum name="suspension course" unit="m" min="0" max="0.2" val="0.07"/>
    <attnum name="bellcrank" min="0.1" max="5" val="0.9"/>
    <attnum name="packers" unit="mm" min="0" max="10" val="10"/>
    <attnum name="slow bump" unit="lbs/in/s" min="0" max="1000" val="500"/>
    <attnum name="slow rebound" unit="lbs/in/s" min="0" max="1000" val="300"/>
    <attnum name="fast bump" unit="lbs/in/s" min="0" max="1000" val="80"/>
    <attnum name="fast rebound" unit="lbs/in/s" min="0" max="1000" val="80"/>
  </section>

  <section name="Front Left Suspension">
    <attnum name="spring" unit="lbs/in" min="0" max="10000" val="5500"/>
    <attnum name="suspension course" unit="m" min="0" max="0.2" val="0.07"/>
    <attnum name="bellcrank" min="0.1" max="5" val="0.9"/>
    <attnum name="packers" unit="mm" min="0" max="10" val="10"/>
    <attnum name="slow bump" unit="lbs/in/s" min="0" max="1000" val="500"/>
    <attnum name="slow rebound" unit="lbs/in/s" min="0" max="1000" val="300"/>
    <attnum name="fast bump" unit="lbs/in/s" min="0" max="1000" val="80"/>
    <attnum name="fast rebound" unit="lbs/in/s" min="0" max="1000" val="80"/>
  </section>

  <section name="Rear Right Suspension">
    <attnum name="spring" unit="lbs/in" min="0" max="10000" val="5500"/>
    <attnum name="suspension course" unit="m" min="0" max="0.2" val="0.13"/>
    <attnum name="bellcrank" min="0.1" max="5" val="1.1"/>
    <attnum name="packers" unit="mm" min="0" max="10" val="10"/>
    <attnum name="slow bump" unit="lbs/in/s" min="0" max="1000" val="400"/>
    <attnum name="slow rebound" unit="lbs/in/s" min="0" max="1000" val="500"/>
    <attnum name="fast bump" unit="lbs/in/s" min="0" max="1000" val="80"/>
    <attnum name="fast rebound" unit="lbs/in/s" min="0" max="1000" val="80"/>
  </section>

  <section name="Rear Left Suspension">
    <attnum name="spring" unit="lbs/in" min="0" max="10000" val="5500"/>
    <attnum name="suspension course" unit="m" min="0" max="0.2" val="0.13"/>
    <attnum name="bellcrank" min="0.1" max="5" val="1.1"/>
    <attnum name="packers" unit="mm" min="0" max="10" val="10"/>
    <attnum name="slow bump" unit="lbs/in/s" min="0" max="1000" val="400"/>
    <attnum name="slow rebound" unit="lbs/in/s" min="0" max="1000" val="500"/>
    <attnum name="fast bump" unit="lbs/in/s" min="0" max="1000" val="80"/>
    <attnum name="fast rebound" unit="lbs/in/s" min="0" max="1000" val="80"/>
  </section>

  <section name="Front Right Brake">
    <attnum name="disk diameter" unit="mm" min="100" max="380" val="380"/>
    <attnum name="piston area" unit="cm2" val="50"/>
    <attnum name="mu" val="0.45"/>
    <attnum name="inertia" unit="kg.m2" val="0.1241"/>
  </section>

  <section name="Front Left Brake">
    <attnum name="disk diameter" unit="mm" min="100" max="380" val="380"/>
    <attnum name="piston area" unit="cm2" val="50"/>
    <attnum name="mu" val="0.45"/>
    <attnum name="inertia" unit="kg.m2" val="0.1241"/>
  </section>

  <section name="Rear Right Brake">
    <attnum name="disk diameter" unit="mm" min="100" max="380" val="330"/>
    <attnum name="piston area" unit="cm2" val="25"/>
    <attnum name="mu" val="0.45"/>
    <attnum name="inertia" unit="kg.m2" val="0.0714"/>
  </section>

  <section name="Rear Left Brake">
    <attnum name="disk diameter" unit="mm" min="100" max="380" val="330"/>
    <attnum name="piston area" unit="cm2" val="25"/>
    <attnum name="mu" val="0.45"/>
    <attnum name="inertia" unit="kg.m2" val="0.0714"/>
  </section>
</params>
