<?xml version="1.0" encoding="UTF-8"?>
<!--
    file                 : berniw3.xml
    created              : Mon Jan 19 19:28:00 CET 2004
    copyright            : (C) 2004 by Bernhard Wymann
    email                : berniw@bluewin.ch
    version              : $Id: berniw3.xml,v 1.1 2004/01/20 13:45:23 berniw Exp $
-->

<!--    This program is free software; you can redistribute it and/or modify  -->
<!--    it under the terms of the GNU General Public License as published by  -->
<!--    the Free Software Foundation; either version 2 of the License, or     -->
<!--    (at your option) any later version.                                   -->

<!DOCTYPE params SYSTEM "../../libs/tgf/params.dtd">

<params name="berniw3" type="robotdef">
  <section name="Robots">
    <section name="index">

	  <section name="1">
		<!-- Driver's name (short please) -->
		<attstr name="name" val="berniw hist 1"/>
		<attstr name="team" val="berniw"/>
		<attstr name="desc" val="Berni's first Bot 1"/>
		<attstr name="author" val="Bernhard Wymann"/>
		<attstr name="car name" val="kc-dino"/>
		<attnum name="race number" val="480"/>
		<attnum name="red" val="0.0"/>
		<attnum name="green" val="1.0"/>
		<attnum name="blue" val="1.0"/>
      </section>

	  <section name="2">
		<attstr name="name" val="berniw hist 2"/>
		<attstr name="team" val="berniw"/>
		<attstr name="desc" val="Berni's first Bot 2"/>
		<attstr name="author" val="Bernhard Wymann"/>
		<attstr name="car name" val="kc-coda"/>
		<attnum name="race number" val="481"/>
		<attnum name="red" val="0.0"/>
		<attnum name="green" val="1.0"/>
		<attnum name="blue" val="1.0"/>
      </section>

	  <section name="3">
		<attstr name="name" val="berniw hist 3"/>
		<attstr name="team" val="berniw"/>
		<attstr name="desc" val="Berni's first Bot 3"/>
		<attstr name="author" val="Bernhard Wymann"/>
		<attstr name="car name" val="kc-gt40"/>
		<attnum name="race number" val="482"/>
		<attnum name="red" val="0.0"/>
		<attnum name="green" val="1.0"/>
		<attnum name="blue" val="1.0"/>
      </section>

	  <section name="4">
		<attstr name="name" val="berniw hist 4"/>
		<attstr name="team" val="berniw"/>
		<attstr name="desc" val="Berni's first Bot 4"/>
		<attstr name="author" val="Bernhard Wymann"/>
		<attstr name="car name" val="kc-alfatz2"/>
		<attnum name="race number" val="483"/>
		<attnum name="red" val="0.0"/>
		<attnum name="green" val="1.0"/>
		<attnum name="blue" val="1.0"/>
      </section>

	  <section name="5">
		<attstr name="name" val="berniw hist 5"/>
		<attstr name="team" val="berniw"/>
		<attstr name="desc" val="Berni's first Bot 5"/>
		<attstr name="author" val="Bernhard Wymann"/>
		<attstr name="car name" val="kc-a110"/>
		<attnum name="race number" val="484"/>
		<attnum name="red" val="0.0"/>
		<attnum name="green" val="1.0"/>
		<attnum name="blue" val="1.0"/>
      </section>

	  <section name="6">
		<attstr name="name" val="berniw hist 6"/>
		<attstr name="team" val="berniw"/>
		<attstr name="desc" val="Berni's first Bot 6"/>
		<attstr name="author" val="Bernhard Wymann"/>
		<attstr name="car name" val="kc-corvette-ttop"/>
		<attnum name="race number" val="485"/>
		<attnum name="red" val="0.0"/>
		<attnum name="green" val="1.0"/>
		<attnum name="blue" val="1.0"/>
      </section>

	  <section name="7">
		<attstr name="name" val="berniw hist 7"/>
		<attstr name="team" val="berniw"/>
		<attstr name="desc" val="Berni's first Bot 7"/>
		<attstr name="author" val="Bernhard Wymann"/>
		<attstr name="car name" val="kc-daytona"/>
		<attnum name="race number" val="486"/>
		<attnum name="red" val="0.0"/>
		<attnum name="green" val="1.0"/>
		<attnum name="blue" val="1.0"/>
      </section>

	  <section name="8">
		<attstr name="name" val="berniw hist 8"/>
		<attstr name="team" val="berniw"/>
		<attstr name="desc" val="Berni's first Bot 8"/>
		<attstr name="author" val="Bernhard Wymann"/>
		<attstr name="car name" val="kc-db4z"/>
		<attnum name="race number" val="487"/>
		<attnum name="red" val="0.0"/>
		<attnum name="green" val="1.0"/>
		<attnum name="blue" val="1.0"/>
      </section>

	  <section name="9">
		<attstr name="name" val="berniw hist 9"/>
		<attstr name="team" val="berniw"/>
		<attstr name="desc" val="Berni's first Bot 9"/>
		<attstr name="author" val="Bernhard Wymann"/>
		<attstr name="car name" val="kc-p4"/>
		<attnum name="race number" val="488"/>
		<attnum name="red" val="0.0"/>
		<attnum name="green" val="1.0"/>
		<attnum name="blue" val="1.0"/>
      </section>

	  <section name="10">
		<attstr name="name" val="berniw hist 10"/>
		<attstr name="team" val="berniw"/>
		<attstr name="desc" val="Berni's first Bot 10"/>
		<attstr name="author" val="Bernhard Wymann"/>
		<attstr name="car name" val="kc-5300gt"/>
		<attnum name="race number" val="489"/>
		<attnum name="red" val="0.0"/>
		<attnum name="green" val="1.0"/>
		<attnum name="blue" val="1.0"/>
      </section>

	</section>
  </section>
</params>







