<?xml version="1.0" encoding="UTF-8"?>
<!--
    file                 : berniw.xml
    created              : Mon Apr 17 13:51:00 CET 2000
    copyright            : (C) 2000 by Bernhard Wymann
    email                : berniw@bluewin.ch
    version              : $Id: berniw2.xml,v 1.5.2.1 2008/05/25 21:56:11 berniw Exp $
-->

<!--    This program is free software; you can redistribute it and/or modify  -->
<!--    it under the terms of the GNU General Public License as published by  -->
<!--    the Free Software Foundation; either version 2 of the License, or     -->
<!--    (at your option) any later version.                                   -->

<!DOCTYPE params SYSTEM "../../libs/tgf/params.dtd">

<params name="berniw" type="robotdef">
  <section name="Robots">
    <section name="index">

	  <section name="1">
		<!-- Driver's name (short please) -->
		<attstr name="name" val="berniw two 1"/>
		<attstr name="team" val="berniw"/>
		<attstr name="desc" val="Berni's second Bot 1"/>
		<attstr name="author" val="Bernhard Wymann"/>
		<attstr name="car name" val="pw-focuswrc"/>
		<attnum name="race number" val="148"/>
		<attnum name="red" val="0.0"/>
		<attnum name="green" val="1.0"/>
		<attnum name="blue" val="1.0"/>
      </section>

	  <section name="2">
		<attstr name="name" val="berniw two 2"/>
		<attstr name="team" val="berniw"/>
		<attstr name="desc" val="Berni's second Bot 2"/>
		<attstr name="author" val="Bernhard Wymann"/>
		<attstr name="car name" val="pw-206wrc"/>
		<attnum name="race number" val="149"/>
		<attnum name="red" val="0.0"/>
		<attnum name="green" val="1.0"/>
		<attnum name="blue" val="1.0"/>
      </section>

	  <section name="3">
		<attstr name="name" val="berniw two 3"/>
		<attstr name="team" val="berniw"/>
		<attstr name="desc" val="Berni's second Bot 3"/>
		<attstr name="author" val="Bernhard Wymann"/>
		<attstr name="car name" val="pw-306wrc"/>
		<attnum name="race number" val="150"/>
		<attnum name="red" val="0.0"/>
		<attnum name="green" val="1.0"/>
		<attnum name="blue" val="1.0"/>
      </section>

	  <section name="4">
		<attstr name="name" val="berniw two 4"/>
		<attstr name="team" val="berniw"/>
		<attstr name="desc" val="Berni's second Bot 4"/>
		<attstr name="author" val="Bernhard Wymann"/>
		<attstr name="car name" val="pw-evoviwrc"/>
		<attnum name="race number" val="151"/>
		<attnum name="red" val="0.0"/>
		<attnum name="green" val="1.0"/>
		<attnum name="blue" val="1.0"/>
      </section>

	  <section name="5">
		<attstr name="name" val="berniw two 5"/>
		<attstr name="team" val="berniw"/>
		<attstr name="desc" val="Berni's second Bot 5"/>
		<attstr name="author" val="Bernhard Wymann"/>
		<attstr name="car name" val="pw-imprezawrc"/>
		<attnum name="race number" val="152"/>
		<attnum name="red" val="0.0"/>
		<attnum name="green" val="1.0"/>
		<attnum name="blue" val="1.0"/>
      </section>

	  <section name="6">
		<attstr name="name" val="berniw two 6"/>
		<attstr name="team" val="berniw"/>
		<attstr name="desc" val="Berni's second Bot 6"/>
		<attstr name="author" val="Bernhard Wymann"/>
		<attstr name="car name" val="pw-corollawrc"/>
		<attnum name="race number" val="153"/>
		<attnum name="red" val="0.0"/>
		<attnum name="green" val="1.0"/>
		<attnum name="blue" val="1.0"/>
      </section>

	  <section name="7">
		<attstr name="name" val="berniw two 7"/>
		<attstr name="team" val="berniw"/>
		<attstr name="desc" val="Berni's second Bot 7"/>
		<attstr name="author" val="Bernhard Wymann"/>
		<attstr name="car name" val="car5-trb1"/>
		<attnum name="race number" val="154"/>
		<attnum name="red" val="0.0"/>
		<attnum name="green" val="1.0"/>
		<attnum name="blue" val="1.0"/>
      </section>

	  <section name="8">
		<attstr name="name" val="berniw two 8"/>
		<attstr name="team" val="berniw"/>
		<attstr name="desc" val="Berni's second Bot 8"/>
		<attstr name="author" val="Bernhard Wymann"/>
		<attstr name="car name" val="car4-trb1"/>
		<attnum name="race number" val="155"/>
		<attnum name="red" val="0.0"/>
		<attnum name="green" val="1.0"/>
		<attnum name="blue" val="1.0"/>
      </section>

	  <section name="9">
		<attstr name="name" val="berniw two 9"/>
		<attstr name="team" val="berniw"/>
		<attstr name="desc" val="Berni's second Bot 9"/>
		<attstr name="author" val="Bernhard Wymann"/>
		<attstr name="car name" val="car7-trb1"/>
		<attnum name="race number" val="156"/>
		<attnum name="red" val="0.0"/>
		<attnum name="green" val="1.0"/>
		<attnum name="blue" val="1.0"/>
      </section>

	  <section name="10">
		<attstr name="name" val="berniw two 10"/>
		<attstr name="team" val="berniw"/>
		<attstr name="desc" val="Berni's second Bot 10"/>
		<attstr name="author" val="Bernhard Wymann"/>
		<attstr name="car name" val="car1-trb3"/>
		<attnum name="race number" val="157"/>
		<attnum name="red" val="0.0"/>
		<attnum name="green" val="1.0"/>
		<attnum name="blue" val="1.0"/>
      </section>

	</section>
  </section>
</params>










