<?xml version="1.0" encoding="UTF-8"?>
<!-- 
    file                 : SWRC62.xml
    created              : Sat Mar 18 23:03:59 CET 2000
    copyright            : (C) 2000 by Eric Espie                         
    email                : torcs@free.fr   
    version              : $Id: default.xml,v 1.1.2.1 2008/05/28 21:34:47 berniw Exp $                                  
-->

<!--    This program is free software; you can redistribute it and/or modify  -->
<!--    it under the terms of the GNU General Public License as published by  -->
<!--    the Free Software Foundation; either version 2 of the License, or     -->
<!--    (at your option) any later version.                                   -->

<!--    3D MODEL copyright (C) Patrick Wisselo  Patwo Design Production 1999 (see readme.txt) -->

<!DOCTYPE params SYSTEM "../../../../src/libs/tgf/params.dtd">

<params name="SWRC62" type="template">

	<section name="Car">
		<attnum name="initial fuel" min="1.0" max="53" unit="l" val="53.0"/>
	</section>
	
	<section name="Front Wing">
		<attnum name="angle" min="0" max="30" unit="deg" val="5"/>
	</section>
	
	<section name="Rear Wing">
		<attnum name="angle" min="0" max="30" unit="deg" val="15"/>
	</section>
	
	<section name="Gearbox">
		<section name="gears">
			<section name="r">
				<attnum name="ratio" min="-5" max="0" val="-2.96"/>
			</section>
			<section name="1">
				<attnum name="ratio" min="0" max="10" val="2.232"/>
			</section>
			<section name="2">
				<attnum name="ratio" min="0" max="10" val="1.625"/>
			</section>
			<section name="3">
				<attnum name="ratio" min="0" max="10" val="1.086"/>
			</section>
			<section name="4">
				<attnum name="ratio" min="0" max="10" val=".856"/>
			</section>
			<section name="5">
				<attnum name="ratio" min="0" max="10" val=".69"/>
			</section>
			<section name="6">
				<attnum name="ratio" min="0" max="10" val="0.6"/>
			</section>
		</section>
	</section>
		
	<section name="Brake System">
		<attnum name="front-rear brake repartition" min="0.0" max="1.0" val="0.68"/>
		<attnum name="max pressure" min="100" max="1500000" unit="kPa" val="23000"/>
	</section>
		
	<section name="Front Differential">
		<!-- type of differential : SPOOL (locked), FREE, LIMITED SLIP -->
		<attstr name="type" in="NONE,SPOOL,FREE,LIMITED SLIP" val="FREE"/>
	</section>
	
	<section name="Rear Differential">
		<!-- type of differential : SPOOL (locked), FREE, LIMITED SLIP -->
		<attstr name="type" in="NONE,SPOOL,FREE,LIMITED SLIP" val="LIMITED SLIP"/>
	</section>
	
	<section name="Central Differential">
		<attnum name="ratio" min="0" max="10" val="6.85"/>
	</section>
	
	<section name="Front Right Wheel">
		<attnum name="ride height" min="150" max="2000" unit="mm" val="100"/>
		<attnum name="toe" min="-5" max="5" unit="deg" val="0"/>
		<attnum name="camber" min="-5" max="0" unit="deg" val="-5"/>
	</section>
	
	<section name="Front Left Wheel">
		<attnum name="ride height" min="150" max="2000" unit="mm" val="100"/>
		<attnum name="toe" min="-5" max="5" unit="deg" val="0"/>
		<attnum name="camber" min="-5" max="0" unit="deg" val="-5"/>
	</section>
	
	<section name="Rear Right Wheel">
		<attnum name="ride height" min="150" max="2000" unit="mm" val="100"/>
		<attnum name="toe" min="-5" max="5" unit="deg" val="0"/>
		<attnum name="camber" min="-5" max="0" unit="deg" val="-3"/>
	</section>
	
	<section name="Rear Left Wheel">
		<attnum name="ride height" min="150" max="2000" unit="mm" val="100"/>
		<attnum name="toe" min="-5" max="5" unit="deg" val="0"/>
		<attnum name="camber" min="-5" max="0" unit="deg" val="-3"/>
	</section>
	
	<section name="Front Anti-Roll Bar">
		<attnum name="spring" min="0" max="10000" unit="lbs/in" val="0"/>
	</section>
	
	<section name="Rear Anti-Roll Bar">
		<attnum name="spring" min="0" max="10000" unit="lbs/in" val="0"/>
	</section>
	
	<section name="Front Right Suspension">
		<attnum name="spring" min="0" max="10000" unit="lbs/in" val="2000"/>
		<attnum name="suspension course" min="0" max="1.0" unit="m" val="0.30"/>
		<attnum name="bellcrank" min="0.1" max="5" val="1.5"/>
		<attnum name="packers" min="50" max="100" unit="mm" val="0"/>
		<attnum name="slow bump" min="0" max="1000" unit="lbs/in/s" val="200"/>
		<attnum name="slow rebound" min="0" max="1000" unit="lbs/in/s" val="100"/>
		<attnum name="fast bump" min="0" max="1000" unit="lbs/in/s" val="50"/>
		<attnum name="fast rebound" min="0" max="1000" unit="lbs/in/s" val="50"/>
	</section>
	
	<section name="Front Left Suspension">
		<attnum name="spring" min="0" max="10000" unit="lbs/in" val="2000"/>
		<attnum name="suspension course" min="0" max="1.0" unit="m" val="0.30"/>
		<attnum name="bellcrank" min="0.1" max="5" val="1.5"/>
		<attnum name="packers" min="50" max="100" unit="mm" val="0"/>
		<attnum name="slow bump" min="0" max="1000" unit="lbs/in/s" val="200"/>
		<attnum name="slow rebound" min="0" max="1000" unit="lbs/in/s" val="100"/>
		<attnum name="fast bump" min="0" max="1000" unit="lbs/in/s" val="50"/>
		<attnum name="fast rebound" min="0" max="1000" unit="lbs/in/s" val="50"/>
	</section>
	
	<section name="Rear Right Suspension">
		<attnum name="spring" min="0" max="10000" unit="lbs/in" val="2000"/>
		<attnum name="suspension course" min="0" max="1.0" unit="m" val="0.30"/>
		<attnum name="bellcrank" min="0.1" max="5" val="1.5"/>
		<attnum name="packers" min="50" max="100" unit="mm" val="0"/>
		<attnum name="slow bump" min="0" max="1000" unit="lbs/in/s" val="100"/>
		<attnum name="slow rebound" min="0" max="1000" unit="lbs/in/s" val="200"/>
		<attnum name="fast bump" min="0" max="1000" unit="lbs/in/s" val="50"/>
		<attnum name="fast rebound" min="0" max="1000" unit="lbs/in/s" val="50"/>
	</section>
	
	<section name="Rear Left Suspension">
		<attnum name="spring" min="0" max="10000" unit="lbs/in" val="2000"/>
		<attnum name="suspension course" min="0" max="1.0" unit="m" val="0.30"/>
		<attnum name="bellcrank" min="0.1" max="5" val="1.5"/>
		<attnum name="packers" min="50" max="100" unit="mm" val="0"/>
		<attnum name="slow bump" min="0" max="1000" unit="lbs/in/s" val="100"/>
		<attnum name="slow rebound" min="0" max="1000" unit="lbs/in/s" val="200"/>
		<attnum name="fast bump" min="0" max="1000" unit="lbs/in/s" val="50"/>
		<attnum name="fast rebound" min="0" max="1000" unit="lbs/in/s" val="50"/>
	</section>
	
	<section name="Front Right Brake">
		<attnum name="disk diameter" min="100" max="500" unit="mm" val="350"/>
		<attnum name="piston area" min="25" max="200" unit="cm2" val="50"/>
		<attnum name="mu" min="0.25" max="0.5" val="0.45"/>
		<attnum name="inertia" min="0.05" max="0.3" unit="kg.m2" val="0.1241"/>
	</section>
	
	<section name="Front Left Brake">
		<attnum name="disk diameter" min="100" max="500" unit="mm" val="350"/>
		<attnum name="piston area" min="25" max="200" unit="cm2" val="50"/>
		<attnum name="mu" min="0.25" max="0.5" val="0.45"/>
		<attnum name="inertia" min="0.05" max="0.3" unit="kg.m2" val="0.1241"/>
	</section>
	
	<section name="Rear Right Brake">
		<attnum name="disk diameter" min="100" max="500" unit="mm" val="200"/>
		<attnum name="piston area" min="25" max="200" unit="cm2" val="50"/>
		<attnum name="mu" min="0.25" max="0.5" val="0.45"/>
		<attnum name="inertia" min="0.05" max="0.3" unit="kg.m2" val="0.1241"/>
	</section>
	
	<section name="Rear Left Brake">
		<attnum name="disk diameter" min="100" max="500" unit="mm" val="200"/>
		<attnum name="piston area" min="25" max="200" unit="cm2" val="50"/>
		<attnum name="mu" min="0.25" max="0.5" val="0.45"/>
		<attnum name="inertia" min="0.05" max="0.3" unit="kg.m2" val="0.1241"/>
	</section>
	
  <section name="berniw private">
    <attnum name="caero" val="1.0"/>
    <attnum name="cfriction" val="1.10"/>
  </section>

</params>



